{
  "approval_fingerprint": "0b963ba982432c50a5f1607c1f0ab2c68232de614dd9734a15c7f62af0fb7c3e",
  "constitution_fingerprint": "b4f1570af852773609bb5a5e35e109c10dc263b24995ddcc8e52fa2961527bcd",
  "decided_at": "2026-07-21T07:00:12+00:00",
  "decision": "approved_for_director_handoff",
  "decision_reason_zh": "用户已明确允许执行下一任务；批准排名第1的Development-only跨周期一致性描述方向进入既有低风险治理链路，不授权回测、Candidate、策略修改、Validation/Holdout或晋级。",
  "discovery_run_id": "discovery-run-66c83d41c84027eb",
  "research_state_fingerprint": "67c3311d8d84d1ef745c3b0c89357a40271197814903f53a570d8cc8fc260dc0",
  "reviewer_type": "human_user",
  "schema_version": "research-direction-approval-v1",
  "selected_critique_fingerprint": "c173d4859e1ae08ff50fed6061309fc764158ed7fc1492211974580ee88c4abc",
  "selected_idea_fingerprint": "d66ac135355abd83a5040c3cead283e4252ee16aa0033f1e0268b7ec20f001b9",
  "selected_idea_id": "bnb-xrp-timeframe-coherence-v1",
  "shortlist_fingerprint": "26d2dfd09598b4fd7a604dd871c109de5acdcd1124a0671d40c0af94d7b1aa2b"
}
